Outlet,Title,Text,Prelim-Rating,Human-Rating,URL
thehindu.com,"Union Budget 2024: NBFC sector seeks more funds to improve liquidity, regulatory reforms from Budget","Ahead of the upcoming Union Budget scheduled to be presented on July 23, the Non-Banking Financial Company (NBFC) sector is expecting enhanced financial inclusion and reinforcing digitalisation efforts to sustain the sector's growth.

Finance Industry Development Council (FIDC), which represents the industry, has suggested establishing a special refinancing body, just as the government has created National Housing Bank (NHB) for housing finance companies.

On the other hand, the sector this year has seen stringent regulatory action from the Reserve Bank of India (RBI). Additionally, speaking at an event in May this year, RBI Deputy governor J. Swaminathan cautioned the NBFCs not to be overly reliant on algo-based credit models. However, the apex bank, in its 29th Financial Stability Report (FSR) said that the NBFCs are well capitalised, giving an edge to the financial sector in the country.

As of the end of March 2024, NBFCs had a CRAR of 26.6%, a GNPA ratio of 4.0% and a return on assets (RoA) of 3.3%.

""The growth of the Indian NBFC industry is significantly influenced by robust financial inclusion, consumer demand and improving trade balances. The upcoming Union Budget should emphasise enhancing financial inclusion across the country, implementing policy reforms, and reinforcing digitalisation efforts to sustain the sector's growth.

Financial and digital inclusion will enhance credit access by increasing convenience and reducing turnaround times,"" said Rakesh Kaul, CEO, Clix Capital.

""The government must consider incentivising and promoting such measures so that NBFCs can carefully take advantage of global integration, ensuring sustainable growth and financial inclusion across India's diverse economic landscape,"" said Jitendra Tanwar, Managing Director & CEO of Namdev Finvest Private Limited.

He further added that the government must consider incentivising and promoting such measures so that NBFCs can carefully take advantage of global integration, ensuring sustainable growth and financial inclusion across India's diverse economic landscape.

Expressing his confidence in the Budget this year, Krishan Gopal, CFO, Aye Finance, said, “I believe this Budget will lay the groundwork for India’s vision of development by 2047. We expect the Government to recognise the efforts of NBFC lenders that are transforming micro-enterprise lending in India by providing customised credit lines, announcing schemes and subsidies and even considering classifying them as Priority Sector Lenders.”

“Despite strong competition from banks, non-banking financial companies (NBFCs) have shown remarkable resilience in retaining a significant market share. To drive further growth, we seek policies that promote responsible credit utilisation, enhance access to credit for underserved communities, and foster financial literacy among customers,” said Mathew Muthoottu, MD Muthoottu Mini Financiers Limited.

”NBFCs are expecting the Budget to carry provisions that spur consumption, such as via tax relief etc.; implement initiatives that enable growth of NBFCs serving priority sector clients; and undertake widespread campaigns aimed at inculcating good credit behaviour amongst the country’s growing borrower base,” opined Neha Juneja, Co-founder and CEO, IndiaP2P, on her Budget expectations.

Anticipating the allocation of additional funds for the sector, Pavitra Walvekar, the CEO of Kudos Finance, which is based out of Pune, said, “Key initiatives should include the allocation of additional funds to improve liquidity for NBFCs and the introduction of regulatory reforms to streamline operations and enhance transparency. These steps will bolster credit availability, particularly for underserved segments like MSMEs, and promote financial stability in the long run.”",Left,,https://www.thehindu.com/business/budget/union-budget-2024-nbfc-sector-seeks-more-funds-to-improve-liquidity/article68406124.ece
thehindu.com,Watch: Jamnagar’s Bandhani saree makers hoping for government support: Union Budget 2024,"Those involved in the Bandhani textile industry of Gujarat’s Jamnagar are advocating for government support, ahead of the upcoming Union budget to be presented by the Finance Minister on July 23.

Jamnagar’s exquisite Bandhani sarees, renowned for their intricate designs and vibrant colours, have not only captivated the Indian market but have also found acclaim worldwide.

This centuries-old art of tie-dyeing fabric, has been meticulously preserved by generations of families in the city.

Video: PTI",Left,,https://www.thehindu.com/news/national/gujarat/watch-jamnagars-bandhani-saree-makers-hoping-for-government-support-union-budget-2024/article68399967.ece
thehindu.com,"Union Budget 2024 Expectations: Keep increasing road-infra spending, frame policies to promote electrification","The growth of the automotive industry in India has happened because of the excellent road infrastructure which has been created during the last couple of years. A lot of intercity travel means that consumers want to have luxury cars, they want to have safer cars and that has helped to drive growth in the industry.

This time from the Union Budget we would expect not only continuity in infrastructure spending but also increased spending on road infrastructure because there exists a lot of head-room for improvement for the industry to grow.

For long-term success of electrification of automobiles, one of the big factors helping us, is the reduced duty structure that enables to price Electric Vehicles (EVs) close to Internal Combustion Engines (ICE) cars. Our expectation is the government comes out with a clear policy roadmap and gives a statement that these incentives on taxes will continue for the next 8 to 10 years.

This will give confidence to customers to get into EVs and also OEMs to invest more when it comes to electrification. OEMs like us would be interested in introducing new cars in the Indian market. In addition, there is also a pressing need for the State governments to continue their commitment towards EV adoption, continuing the tax breaks and incentives that attract end consumers.

For charging infrastructure the onus is on Charging Point Operators (CPOs) to set up the desired network to democratise their chargers. Today, we find that a lot of CPOs are not opening up their APIs so the customers need to download multiple apps to charge their cars.

To address this the government can come with a common platform for all CPOs to list, so that customers have the ease of payment like UPI to transact when it comes to charging their EVs. Apart from this, there are a lot of good ideas the world over to make it toll free for electric cars, providing special parking facility in cities for EVs. So, I think, no amount of incentives is less, because electrification needs a major push from the government.

As India aggressively transitions towards carbon neutrality, the government’s role also becomes more pronounced. We believe the road towards creating a carbon-neutral ecosystem will come from zero emission, which can be delivered by electrification. OEMs, their suppliers, vendors, policymakers and all other key stakeholders have to come together, work in close cooperation to ensure we create a robust, resilient and time-bound EV ecosystem.

At OEM level, the industry is ensuring that we actively encourage the EV adoption not just by launching high-tech and desirable product offerings, but we also focus on easing the total cost of ownership. This the OEMs are doing via offering long battery warranties, attractive residual value for EVs which are comparable to ICE vehicles and also extending service intervals to prolong any workshop visits.

The industry should continue to not only focus on introducing new products, but also spend their time and resources for enhancing consumer-education initiatives across markets. The actual acceleration for EV adoption can only happen when there is a strong demand from consumers for these technologies; but for that, we need concerted and coordinated efforts from OEMS, policymakers and customers.

When it comes to import duties, we have been in India for 30 years doing business based on the current taxation structure. Though lower taxes are always welcome, we also need to be pragmatic considering the current economic as well as political compulsions. So, we are realistic there, when it comes to tax cost. Hopefully, there are no increases as such in this Union Budget and there is continuity in taxation which should help us to do business as usual.

We expect the Indian auto industry to grow at 7% to 8% or maximum at 10% this year. The luxury car market size is 1 to 1.2% of the total industry and this segment should grow in double digit, may be slightly faster than the mass market passenger cars, because the base is low.

Right now, if you look at the enablers; the stock market is at all-time high, the real estate sector is doing well, tax collections are at a record high. So, we do not see any impediments to achieve the projected growth. With the incoming festive season combined with the wedding season and the depreciation month of September [a lot of consumers buy cars in September to claim depreciation benefits), I think the market will remain strong in the rest part of the year as well.

(Santosh IyerisManaging Director & CEO, Mercedes-Benz India. As told to Lalatendu Mishra)",Left,,https://www.thehindu.com/business/budget/keep-increasing-road-infra-spending-frame-policies-to-promote-electrification/article68389395.ece
thehindu.com,Budget 2024: Insurers expect more tax benefits for health insurance in Union budget,"More tax benefits for health insurance under the new tax regime, relaxation in payment norms for MSMEs and incentives for the agri-tech sector are among the expectations of stakeholders from the first budget of the Modi 3.0 government.

Finance Minister Nirmala Sitharaman is scheduled to present the full Budget for fiscal 2024-25 on July 23, which will be the first major policy document of the new government.

Click here for more 2024-25 Budget related updates

Anup Rau, Managing Director and Chief Executive Officer of Future Generali India Insurance Company, said the deduction limit on health insurance premiums under Section 80D of the Income Tax Act has remained unchanged for the past nine years despite the fact that there has been a significant rise in healthcare costs across the country.

""It would be best if the limit for medical insurance is linked to inflation and gets revised automatically every year or once in a couple of years. Also, the benefits need to be extended to the New Tax regime since increasing health insurance penetration is critical. So, we hope the upcoming Budget to announce some hike in the deduction limit on health insurance premiums,"" Rau said.

Tapan Singhel, MD & CEO of Bajaj Allianz General Insurance, said reforms like offering health insurance to employees at negotiated rates, reducing GST on health insurance premiums, and offering tax benefits like increased Section 80D exemption limits would make health insurance more affordable and accessible, especially for the 'missing middle' segment of our population.

""Additionally, for senior citizens, removing the limit on deductions for health insurance premiums would significantly ease their financial burden,"" Mr. Singhel said.

The Finance Minister is likely to lay out the government's economic agenda in the budget.

On expectations from the Ms. Sitharaman's budget, D S Negi, CEO of Rajiv Gandhi Cancer Institute & Research Centre (RGCIRC), said the focus on reforming cancer care in India is crucial and it is important to prioritise funding for advanced treatments like immunotherapy and personalised medicine, ensuring more patients can access these cutting-edge therapies.

""Extending Ayushman Bharat to those aged above 70 years will be highly beneficial for senior citizens. However, the current coverage limit of ₹5 lakh may not be sufficient for critical illnesses such as cancer, where treatment costs can range from ₹15-20 lakh.

""Therefore, it is essential to consider increasing the coverage limit for critical illnesses like cancer to ensure adequate financial support for cancer patients,"" Mr. Negi added.

The budget is likely to include steps to fast-rack reforms to make India a USD 5-trillion economy in the near future and turn the country into a 'Viksit Bharat' by 2047.

Ahead of the budget, Chairman of the Medical Technology Association of India (MTaI) Pavan Choudary said that customs duties and taxes levied on medical devices in India are one of the highest in the world which directly impacts patient affordability.

""On the other hand, countries like Singapore, Hong Kong, Italy, and Norway impose no such duties. Australia and Japan levy only a minimal 0.5 per cent duty, while in the United States, it stands at 2 per cent, and in China at 3 per cent.

""This stark contrast creates risk for illegal imports of medical devices in India that are not backed by legal and service guarantees. Furthermore, such trade would undercut the Indian government's tariff revenue,"" he said.

Vivek Jalan, Partner at Tax Connect Advisory Services LLP, said as per recommendations of Micro, Small & Medium Enterprises (MSMEs), Section 43B(h) in the Income Tax Act was introduced from AY 24-25. However, the alignment of the disallowance for payables under sections 43B(h) of the Act has been made with the MSME Act, which requires that payment has to be made to an SME within a maximum of 45 days.

""This is difficult in the present-day trade where a 60-90 days credit period is the norm.

""In this budget, it is expected that this provision will be relaxed/amended aligning the same with the CGST Act w.r.t. disallowance when payment to SMEs is not made within 180 days. Hence, in case a taxpayer does not pay an SME within 180 days, then the expense may be added back to his income,"" he said.

In anticipation of the budget, Saurabh Rai, CEO of Arahas, has expressed high expectations for substantial investments in sustainability and geospatial technology.

""We anticipate significant allocations towards renewable energy projects and incentives for companies embracing green technologies,"" he said.

Additionally, Rai said that boosting agri-tech innovations, providing tax incentives for tech companies and investing in human capital development is imperative for driving sustainable growth.

Sanjay Kumar, Founder and CEO of Geospatial World, said that to fully leverage the power of digital twin technology, it is crucial to allocate dedicated funds to it in the Union Budget.

""This allocation will facilitate the widespread adoption of digital twins, driving efficiency gains, cost savings, and improved decision-making in infrastructure projects. By investing in this technology, India can achieve significant long-term benefits, such as enhanced asset management, reduced downtime, and increased resilience to environmental challenges,"" Mr. Kumar said.

Ms. Sitharaman was given charge of the finance portfolio in the second stint of the Modi government after the 2019 general elections, becoming the first full-time woman Finance Minister in independent India.",Left,,https://www.thehindu.com/business/budget/budget-2024-insurers-expect-more-tax-benefits-for-health-insurance-in-union-budget/article68395891.ece
thehindu.com,"Budget 2024: Pharma industry seeks tax benefits, effective intellectual property rights regime","There is a need to incentivise R&D investments, offer corporate tax concessions and establish an effective intellectual property rights regime in order to push the growth of domestic pharmaceutical industry, as per the industry bodies.

Outlining the sector's wish list for the upcoming Union Budget, Organisation of Pharmaceutical Producers of India (OPPI) Director General Anil Matai urged the government to explore methods to incentivise R&D investments, such as deductions on R&D expenses, research-linked incentives for MNCs, and corporate tax concessions.

The initiatives will help in accelerating R&D and innovation in the sector, he added.

""Recognising the high-risk, long-gestation nature of R&D, we suggest extending the scope of section 115BAB of the Income Tax Act, 1961 to companies solely engaged in pharmaceutical research and development and providing a 200 per cent deduction rate on R&D expenditures,"" Matai said.

This would significantly boost the sector's ability to undertake essential research and development, including clinical trials and patent registration, he added.

Matai also sought establishing an effective intellectual property rights regime for driving growth and encouraging research-based pharma companies, both global and domestic, to introduce innovative therapies in India towards addressing unmet medical needs.

Besides, he sought introduction of incentives for centres and companies that provide specialised training programmes for pharmaceutical employees.

""Incentives for developing treatments for rare diseases are also crucial,"" Matai said.

Besides, enhancing the management of rare diseases through more centres of excellence (CoEs), increased budget allocations for incentivising R&D on therapies for rare disease, and import duty waivers are essential, he noted.

""Expanding the list of life-saving drugs eligible for GST/import duty exemptions, including all oncology medications, will further improve patient affordability,"" Matai said.

In order to attract investment and contribute to a more resilient and future-ready pharmaceutical industry, the government should provide incentives for investments in bonds issued by pharmaceutical companies, he added.

OPPI represents the research-based pharmaceutical companies, including AstraZeneca, Novartis and Merck, in India.

Indian Pharmaceutical Alliance (IPA) Secretary General Sudarshan Jain said the policy direction should leverage the industry's knowledge-driven foundation and the status as a global manufacturing hub.

The thrust should be on quality and innovation, he stated.

Given the high risk, lengthy development periods, and low success rates in research, continuous investment is crucial, he added.

""The 2024-25 budget should introduce policies that provide direct and indirect tax benefits to encourage research and investment in becoming a global benchmark in quality,"" Jain said.

IPA is an association of leading research-based pharmaceutical companies in India.

The members include Cipla, Dr Reddy's Laboratories, Sun Pharma and Lupin.",Left,,https://www.thehindu.com/business/budget/budget-2024-pharma-industry-seeks-tax-benefits-effective-intellectual-property-rights-regime/article68377617.ece
thehindu.com,Union Budget 2024: Real estate’s wishlist,"The Indian real estate sector is a crucible of economic growth and employment. The sector stands at a crossroads as the government prepares to present its Union Budget in July. Though it has massive potential, the Indian housing industry still faces numerous hurdles.

To generate more growth and address the housing needs of a growing population, particularly in the low and mid-income segments, the Budget must include tax breaks, regulatory reforms, and financial assistance measures.

Affordable and mid-income housing is the foundation of the real estate industry, meeting the urgent housing needs of the enormous low-income group and middle-class population. To significantly boost this section, the following strategies are critical:

Interest subsidies and housing loans

Raising the interest subsidy for housing loans is the need of the hour. Doing this will make homeownership more affordable. Reducing interest rates will also lower the financial stress on aspiring homebuyers. The government should seriously think about widening the scope of the Pradhan Mantri Awas Yojana (PMAY).

Enhanced Credit-Linked Subsidy Scheme (CLSS)

Extending and improving CLSS can provide financial relief to mid-income homebuyers. Both the income eligibility threshold and subsidy amount should be raised.

Single-window clearance

A single-window clearance system for budget home projects will help considerably to make the complex approval process more streamlined and simple. This, in turn, would help to decrease delays in possession of such units and reduce the overall costs.

Tax breaks

To lighten the load and make homeownership approachable, tax breaks come handy. They can also encourage builders to take on new affordable housing projects.

Raising the tax deduction limit under Section 24(b) of the IT Act is long overdue. The deduction limit should be increased from the current ₹2 lakh to at least ₹3 lakh or even more.

Reduce stamp duty

The government can encourage state governments to cut their stamp duty rates, which account for a significant portion of the cost of homeownership. Even a temporary decrease or waiver of stamp duty on affordable and lower-middle-income housing can boost demand and sales.

Incentives for first-time buyers

First-time homebuyers should get further sentiment boosters. For instance, the government can raise the deduction limit under Sections 80EE and 80EEA for such buyers.

GST reforms for developers

GST rates applicable on construction materials and services can help lower overall project costs for builders. Also, a reduced GST rate for affordable housing projects would help attract more builders to this vital segment and to pursue such projects.

Apart from direct financial boosters, the Budget can introduce many policy initiatives, which will indirectly improve sentiment in the housing sector:

Fast-track infrastructure

The government is determined to develop infrastructure like roads and public transport such as metros and railways. This helps expand metropolitan areas and boosts affordable housing, which is usually developed in emerging areas where land is cheaper and infrastructure is still catching up. However, we need a much faster roll-out of such projects so that connectivity to such areas improves at a faster pace.

Land reforms

Simplifying the overall land acquisition process will help developers speed up their supply of new projects. There is an express need for an open and effective land records management system that reduces disputes and, therefore, project delays.

Better finance access

Developers always need access to financing, but smaller and medium-scale players are at a bigger disadvantage than big players. The Budget could consider announcing a separate real estate investment fund and also credit guarantees to such builders so that their cash flow improves.

Rental housing policy

Rental housing would benefit from favourable policies and tax incentives for those who cannot afford to buy homes. Implementing a model tenancy law and providing tax breaks on rental income would help a lot.

The writer is Managing Director, Pharande Spaces.",Left,,https://www.thehindu.com/real-estate/real-estate-properties-housing-construction-union-budget/article68335278.ece
