Outlet,Title,Text,Prelim-Rating,Human-Rating,URL
hindustantimes.com,"Income Tax Budget Highlights: Govt proposes tax cuts, more standard deduction","New Tax Regime LIVE updates: Union Finance Minister Nirmala Sitharaman presents the Union Budget 2024-25 in Lok Sabha, in New Delhi, Tuesday, July 23, 2024.

New Tax Regime Highlights: Union finance minister Nirmala Sitharaman presented her seventh consecutive Budget amid expectations from the middle class for relief at the tax front. The economy expanded by 8.2% in the past fiscal year, yet private consumption, which accounts for over half of the country's GDP, grew at a much slower pace of 4%. To stimulate consumer spending, the government may consider reducing personal income tax for those with the highest propensity to spend, Bloomberg News reported last month. This move could benefit individuals with annual earnings between ₹5 lakh and ₹15 lakh, who are currently taxed at rates ranging from 5% to 20%....Read More

Prime Minister Narendra Modi's government is expected to maintain a focus on reducing the fiscal deficit while also cutting taxes and increasing welfare spending to satisfy his allies.

Follow LIVE updates on Union Budget 2024-25

What are expectations of taxpayers from Budget 2024-25?

1. Adjusting income tax slabs and rates to provide relief to the middle class.

2. Increasing disposable income and consumer spending.

3. Simplifying and rationalising the capital gains tax structure across various asset classes.

4. Reducing complexity and improving compliance.

5. Reducing corporate tax rates, particularly for MSMEs.

6. Stimulating business activity and investment.



What Economic Survey said about direct taxes?

According to Economic Survey 2023-24 released on Monday the growth in gross tax revenue (GTR) for FY24 was estimated at 13.4 per cent, resulting in a tax revenue buoyancy of 1.4. This growth was driven by a 15.8 per cent increase in direct taxes and a 10.6 per cent rise in indirect taxes compared to FY23. Direct taxes contributed approximately 55 per cent of the GTR, while indirect taxes made up the remaining 45 per cent. This increased contribution from direct taxes aligns with the government's efforts to enhance progressivity in taxation, the finance ministry document added.

Moreover, the efficiency of tax collection has improved over time, with the cost of collecting direct taxes dropping from 0.66 per cent of gross collections in FY20 to 0.51 per cent in FY23. The strong growth in both direct and indirect taxes, fueled by resilient economic activity and increased compliance, resulted in tax revenues exceeding conservative budgetary estimates.

PM Modi on Budget 2024-25

Prime Minister Narendra Modi, addressing reporters outside the parliament on Monday, said that the Budget for 2024-25 will outline policies for the next five years, with a focus on youth, farmers, the poor, and women. He added that the budget aims to lay the foundation for India's transformation into a developed nation by 2047.

",,,https://www.hindustantimes.com/budget/income-tax-budget-2024-live-income-tax-slabs-capital-gain-tax-fm-sitharaman-latest-updates-101721664263753.html
hindustantimes.com,Budget 2024: FM Nirmala Sitharaman proposes simpler tax regime to boost cruise ship industry,"Finance minister Nirmala Sitharaman on Tuesday proposed a simple tax scheme for foreign shipping companies operating domestic cruises to boost cruise tourism in the country during the Union budget presentation. ""To give a fillip to this employment generating industry, I am proposing a simpler tax regime for foreign shipping companies operating domestic cruises in the country,"" Sitharaman said (File Photo)

Minister Sitharaman said ownership, leasing and flagging reforms will be implemented to increase the share of the Indian shipping industry and generate more employment.

""To give a fillip to this employment generating industry, I am proposing a simpler tax regime for foreign shipping companies operating domestic cruises in the country,"" she said, reported news agency PTI.

These amendments which are set to take effect from April 1, 2025, have been proposed in the budget to make India an attractive tourism destination, to attract global tourist to cruise shipping in India and to popularise cruise shipping with Indian tourists.

According to the budget document, a new taxation regime for cruise-ships business by non residents comes with a tax exemption for lease rentals, if the foreign company and the non-resident cruise ship operator have the same holding company.



It was also proposed to insert a new Section 44 BBC which would ensure that 20 per cent of the total earnings of the non-resident cruise ship operators, would be considered their profit. This would nullify the existing Section 44 B relating to presumptive taxation for shipping business of non-residents for cruise-ship business.

The amendments will accordingly, apply in relation to the assessment year 2025-26 and subsequent assessment years, reported PTI.

According to the budget document, participation of international cruise-ship operators in this sector will encourage its development and thus create access to the best international practices.

(with inputs from PTI)",,,https://www.hindustantimes.com/india-news/budget-2024-fm-nirmala-sitharaman-proposes-simpler-tax-regime-to-boost-cruise-ship-industry-101721729261970.html
hindustantimes.com,"Budget 2024: Standard deduction raised to Rs. 75,000 under new tax regime. How will it benefit salaried class?","While presenting the Union Budget for 2024-25 in the Lok Sabha, finance minister Nirmala Sitharaman announced an increase in the standard deduction for salaried employees from ₹50,000 to ₹75,000 under the new income tax regime for Fiscal Year 2025. Salaried taxpayers will continue to be eligible for a standard deduction of only ₹ 50,000 under the old regime (Unsplash) (Pics used for representation)

However, there has been no change in the old tax regime regarding the standard deduction. Therefore, salaried taxpayers will continue to be eligible for a standard deduction of only ₹50,000 under the old regime.

The standard deduction for family pensioners has also increased from ₹15,000 to ₹25,000. This marks the first increase in the standard deduction limit in five years, with the previous adjustment occurring in the Interim Budget of 2019, when the limit was raised to ₹50,000, effective from April 1, 2019.

The standard deduction provision had been removed for several years before being reintroduced during the Budget announcement in 2018. This benefit is available to individuals with salary or pension income, which applies only to salaried employees and pensioners.

How do you claim a standard deduction?

The standard deduction is a direct reduction applied to salary and pension income, and no documentation is needed to claim it. It is automatically applied based on the salary or pension income reported in the income tax return. Therefore, it is essential to report the receipt of salary or pension income.

What is the purpose of ‘standard deduction’?

The standard deduction is typically subtracted from the gross salary and can be claimed by all salaried employees without any investment, regardless of their category.

According to ClearTax, the introduction of the standard deduction aims to:

- Simplify tax filing by minimising paperwork and allowing deductions without requiring proof of actual expenses.

- Provide tax relief to middle-class salaried individuals.

- Extend benefits to pensioners through the standard deduction.

When was standard deduction first introduced?

The standard deduction had been available earlier but was abolished by the Finance Act of 2005.

In Budget 2018, finance minister Arun Jaitley introduced a standard deduction of ₹40,000, benefiting the salaried class by replacing the transport allowance of ₹19,200 and medical reimbursement of ₹15,000 per annum.

In the interim budget of 2019, the standard deduction was increased by ₹10,000, raising it to ₹50,000, effective from April 1, 2019.

The recent adjustment in the Budget 2024-25 raised the standard deduction to ₹75,000 under the new tax regime, benefiting salaried individuals and pensioners by reducing their taxable income and lowering their tax liability.

Family pensioners will also benefit from a higher deduction of ₹25,000.

This standard deduction is available to individuals receiving salary or pension income, but according to the TOI, it does not apply to annuity payments from insurance companies, which are taxable under ""Income from Other Sources.""",,,https://www.hindustantimes.com/business/budget-2024-standard-deduction-raised-to-rs-75-000-under-new-tax-regime-how-will-it-benefit-salaried-class-101721731794881.html
hindustantimes.com,"Budget 2024: Mobile Phones, Chargers To Get Cheaper Or Costlier? Watch FM Nirmala's Announcement","Budget 2024: Mobile Phones, Chargers To Get Cheaper Or Costlier? Watch FM Nirmala's Announcement

Providing relief to consumers, the Centre will reduce the basic customs duty on mobile phones, mobile chargers to 15%, Union Finance Minister Nirmala Sitharaman announced while presenting the 2024 Union Budget on July 23. Remember, smartphone manufacturing is a key plank of Prime Minister Narendra Modi’s ambitions to boost the Indian economy and create jobs by attracting companies such as Apple, Foxconn and Samsung.",,,https://www.hindustantimes.com/videos/budget-2024-mobile-phones-chargers-to-get-cheaper-or-costlier-watch-fm-nirmalas-announcement-101721727152928.html
hindustantimes.com,Budget 2024: BSNL gets lion's share of ₹1.28 lakh crore for telecom sector,"Government-owned Bharat Sanchar Nigam Limited (BSNL) has been allocated a lion's share of ₹82,916 crore out of the total ₹1.28 lakh crore earmarked for the telecom sector. As per data from telecom regulator TRAI, BSNL lost nearly 2.3 million subscribers, limiting its user base to just 88.06 million in March 2024. And deployment work for the 4G network has been ongoing at a much lesser pace than expected.((REUTERS))

Finance minister Nirmala Sitharaman in her budget speech proposed to allocate over ₹1 lakh crore together for both BSNL and MTNL, another state-owned entity. A majority of the funds for BSNL are set to be used for technology upgradation and restructuring of the organisation.

""The total net allocation for this demand in BE (Budget Estimate) 2024-25 is ₹1,28,915.43 crore ( ₹1,11,915.43 crore plus ₹17,000 crore). The additional provision of ₹17,000 crore is met from the balances available under Universal Service Obligation Fund and will be utilised for schemes viz., Compensation to Telecom Service Providers, Bharatnet and Research and Development,"" the budget document said.



For pension-related expenses of the Department of Telecommunications (DoT) employees, including BSNL and MTNL, the budget has made a provision to allocate ₹17,510 crore with effect from April 1, 2014. To pay the principal amount of MTNL-related bonds, the government has proposed to allocate ₹3,668.97 crore.

The budget has made provision of ₹34.46 crore for Technology Development and Investment Promotion, ₹70 crore for Champion Service Sector Scheme and ₹1,806.34 crore for Production Linked Incentive Scheme.



To boost domestic manufacturing of telecom-related equipment and discourage imports, Sitharaman has proposed to increase the import duty on motherboards, also known as called Printed Circuit Boards (PCB)'s, by 5 per cent. “To incentivise domestic manufacturing, I propose to increase the BCD (Basic Customs Duty) from 10 per cent to 15 per cent on PCBA (printed circuit board assembly) of specified telecom equipment,” she added.

The import duty hike exempts PCB's that are made of critical and strategic minerals used in the manufacturing of communication equipment.

25 minerals, such as lithium, copper, cobalt, and rare earth elements, which are critical for sectors like nuclear energy, renewable energy, space, defense, telecommunications, and high-tech electronics are fully exempt from customs duties and basic custom duties (BCD) on two of them has been reduced. ""This will provide a major fillip to the processing and refining of such minerals and help secure their availability for these strategic and important sectors,"" Sitharaman said.

(With PTI inputs)",,,https://www.hindustantimes.com/budget/budget-2024-bsnl-gets-lions-share-of-rs-1-28-lakh-crore-for-telecom-sector-101721735885955.html
hindustantimes.com,Budget 2024: Investors welcome move to scrap controversial Angel tax on startups,"Finance minister Nirmala Sitharaman on Tuesday announced the government's decision to scrap the controversial angel tax as part of union budget announcements. The move is expected to encourage investments into startups and spur innovation. Investments received by businesses and startups from high-net-worth individuals, beyond their fair market value, is taxed at 31%.

“To bolster the India startup ecosystem, to boost entrepreneurial spirit and support innovation, I propose abolishing angel tax for all classes of investors,” said the finance minister during her budget speech.



This move, which addresses the key demand of the startup ecosystem, follows several attempts by the community to simplify the system. The decision ""eliminates a major hurdle, making it easier and more attractive for investors to support early-stage startups,"" said Prashanth Prakash, a partner at venture capital firm Accel to Reuters.

What is Angel tax?

It is a 31 per cent tax imposed on investments by angel investors, majorly high-net-worth individuals who invest in business startups or small and medium-scale companies. Formally known as Section 56(2) (vii b) of the Income tax Act, it was imposed to tax funds raised by startups from angel investors, more than their fair market value, notes a report by Moneycontrol.

Startups have contested the methods used by the authorities to assess their fair market value and call it “impractical”. Last year the tax was extended to transactions involving foreign investors as well.

Union minister for railways and IT Ashwini Vaishnaw told PTI that the move will spur investment in startups. ""Angel tax has been a long-standing issue. Deep tech startups had a major issue on how we do valuation. That point has been addressed with its abolition,"" he said at a post-budget conference.

Move welcomed

Shaadi.com founder and Shark Tank India judge Anupam Mittal welcomed the move. “LTCG has also been harmonised across pvt and public cos at 12.5%. Another shot in the arm for startup investors,” Mittal posted on X (formerly twitter).

Congress leaders P Chidambaram and Shashi Tharoor also welcomed the move saying the party had recommended the same years ago to then finance minister Arun Jaitley.

(With inputs from Reuters)",,,https://www.hindustantimes.com/budget/budget-2024-investors-welcome-move-to-scrap-controversial-angel-tax-on-startups-101721741950237.html
hindustantimes.com,Budget 2024: Rent has to be declared under 'income from house property' tax head,"Finance Minister Nirmala Sitharaman proposed in the Union Budget that income from letting out a house or part of the house by the owner would have to be declared as income from house property while filing income tax. Union Finance Minister Nirmala Sitharaman during the post-budget Press Conference at National Media Centre, New Delhi. (PTI)

Nirmala Sitharaman said some taxpayers were reporting their rental income under the wrong income tax head, profits and gains of business or profession, thereby reducing their tax liability.

""It has been observed that some taxpayers are reporting their rental income generated by letting out of the house property, under the head ‘Profits and gains of business or profession’ in place of the head ‘Income from house property’. Accordingly, they are reducing their tax liability substantially by showing house property income under the wrong head of income,"" she said.

She proposed that the Centre would amend section 28 to clarify that any income rental income through the taxpayer's house shall not be chargeable under the ""profits and gains for business or profession"" head.



The new rule is likely to increase the tax liability of such people.

""In view of the same, it is proposed to amend section 28 of the Act to clarify that any income from letting out of a residential house or a part of the house by the owner shall not be chargeable under the head ‘Profits and gains of business or profession’ and shall be chargeable under the head 'Income from house property,"" she said.



She added that the amendment will take effect from the next financial year.

Regarding TDS (tax deducted at source) on the sale of immovable property, she clarified that ""where there is more than one transferor or transferee in respect of an immovable property, then such consideration for transfer of the immovable property shall be the aggregate of the amounts paid or payable by all the transferees to the transferor or all the transferors for transfer of such immovable property"".

Sitharaman also proposed amendments to the Prohibition of Benami Property Transactions Act, of 1988.

""It is proposed to provide immunity from penalty and prosecution to benamidar on full and true disclosure. It is also proposed to rationalize time limits for attachment of property and reference to adjudicating authority,"" she said.

With inputs from PTI",,,https://www.hindustantimes.com/budget/budget-house-rent-to-fall-under-income-from-house-property-tax-head-101721741274364.html
hindustantimes.com,9 priorities of Union Budget 2024: Energy security to next-gen reforms,"Finance minister Nirmala Sitharaman on Tuesday presented the Budget for 2024-25. She outlined nine priorities for 'Viksit Bharat,' saying that the people have been given a “unique opportunity by reaffirming their faith in the Modi-led government” with its third term re-election. Budget 2024: Finance minister Nirmala Sitharaman presents Budget 2024-25 with 9 priorities for 'Viksit Bharat'(Sansad TV)

Follow- Budget 2024 Live Updates

This is the first Budget under Prime Minister Narendra Modi's third term in office.

While presenting the Budget in the Lok Sabha, FM Nirmala Sitharaman said despite ongoing global policy uncertainty, India’s economic growth continues to stand out. Sitharaman added that India's growth remains robust and inflation is low and stable, moving towards the 4 per cent target.

As mentioned in the interim budget, there is a need to focus on the poor, women, youth, and farmers, the minister said.

Follow- Income Tax Budget 2024 LIVE

What are the 9 priority areas of Union Budget?

FM Nirmala Sitharaman said that the people have given the government a unique opportunity to guide India toward strong development and all-round prosperity. The Union Budget 2024-25 envisaged sustained efforts on 9 priorities for “generating ample opportunities” for all.

1. Productivity and Resilience in Agriculture

2. Employment and Skilling

3. Inclusive Human Resource Development and Social Justice

4. Manufacturing and Services

5. Urban Development

6. Energy Security

7. Infrastructure

8. Innovation, Research, and Development

9. Next Generation Reforms

""This budget will decide the direction of our work for the next five years and this will lay the foundation of fulfilling our objective to make India a developed country by 2047,"" PM Modi said on Monday ahead of the budget.

Nifty, Sensex trade flat

Indian shares fell moderately as Finance Minister Nirmala Sitharaman delivered the Union Budget speech.

Follow- Stock market Live Updates

By 11:34 am, the BSE Sensex was down about 0.08 per cent. Nifty 50 fell 0.13 per cent as the budget was announced.",,,https://www.hindustantimes.com/budget/9-priorities-of-union-budget-2024-energy-security-to-next-gen-reforms-101721713207837.html
hindustantimes.com,"‘FM holds up an umbrella for all’: Harsh Goenka on ‘detailed, well-researched’ Budget 2024","Harsh Goenka, chairman of RPG Enterprises, shared his views on the Budget 2024 presented in the Parliament by Finance Minister Nirmala Sitharaman. He found the Budget “meticulous, detailed and well-researched”, adding that FM Sitharaman held up an umbrella for all. Harsh Goenka is all praises for the Union Budget presented by Nirmala Sitharaman in Parliament.

“After a world cup win by the men in blue, a match-winning budget by FM Sitharaman for Team India - focusing on common man's interests. Meticulous, detailed and well-researched, ingraining the pulse of the country, under an experienced Captain’s leadership,” wrote Harsh Goenka on X.

In a separate post, he wrote, “In the midst of rain all around, FM holds up an umbrella for all, though the market ends up getting some splashes!”

Many people reacted to Harsh Goenka’s posts on X. While some reposted them with their thoughts, many dropped comments on them.

Check out a few reactions here:

“But once again, at the cost of the salaried and middle class!” said an X user.

Another asked, “Sarcasm?”

“Budget 2024 - ‘Boring, Lifeless and Meaningless’,” commented a third, referring to what BharatPe co-founder Ashneer Grover said on Budget 2024.

A fourth shared, “Pay - 30 per cent tax on salary, 4 per cent Health and Education Cess on tax payable, GST on everything you purchase. If you manage to save something and invest, pay: 30 per cent on savings and FDs interest, 20 per cent on investments under 1 year and 12.5 per cent on long term.”

“Nowadays, people post sarcastic tweets!” expressed yet another X user.

Highlights from Budget 2024

In her record seventh consecutive Union Budget presentation, Nirmala Sitharaman announced a reduction of basic customs duty (BCD) on mobile phones, mobile chargers, gold, silver and others. The Budget also exempts three cancer treatment medicines from BCD. The Union Budget 2024 proposed to allocate ₹2 lakh crore for job creation over five years. The government will also launch three schemes for employment-linked incentives.

The Finance Minister revised the tax slabs for those who opted for the new regime. “Under the new tax regime, tax rate structure to be revised as follows - ₹0- ₹3 lakh -Nil; ₹3-7 lakh -5%; ₹7-10 lakh-10%; ₹10-12 lakh-15%; 12-15 lakh- 20% and above ₹15 lakh-30%,"" she announced.

The income tax standard deduction for those who opted for the new tax regime has also been reduced. She said, “For those opting for the new tax regime, the standard deduction for salaried employees to be increased from ₹50,000 to ₹75,000.”

Nirmala Sitharaman said that the nine priorities of the Budget include productivity, jobs, social justice, urban development, energy security, infrastructure and reforms.",,,https://www.hindustantimes.com/trending/fm-holds-up-an-umbrella-for-all-harsh-goenka-on-detailed-well-researched-budget-2024-101721728953988.html
hindustantimes.com,Zerodha's Nithin Kamath reacts on Budget 2024: ‘May cool down stock markets’,"Zerodha founder and CEO Nithin Kamath said that the changes announced in the Budget 2024 by Union finance minister Nirmala Sitharaman in tax rates for the stock trading could cool down market activity. Zerodha co-founder Nithin Kamath

What are the changes that Nithin Kamath referred to?

In the Budget, the finance minister proposed to hike the rates of Securities transaction tax (STT) on the sale of an option in securities from 0.0625 per cent to 0.1 per cent of the option premium and on the sale of a futures in securities from 0.0125 per cent to 0.02 per cent of the price at which such futures are traded from October 1.

What Nithin Kamath said on the Budget?

""We collected about ₹1,500 crore of STT last year, @zerodhaonline. If the volumes don't drop, this will increase to about ₹2,500 crores at the new rates,"" Kamath said.

He added, ""The capital gains tax has been increased from 10 percent to 12.5 percent, and it will apply from today. If the idea was to cool down the activity in the markets, this might just do the trick.""",,,https://www.hindustantimes.com/business/zerodhas-nithin-kamath-reacts-on-budget-2024-may-cool-down-stock-markets-101721725036911.html
hindustantimes.com,Shaadi.com's Anupam Mittal praises Budget 2024 but says ‘ye dil maange more’,"Shaadi.com founder and Shark Tank India judge Anupam Mittal, said that startups are finally happy as the “much-dreaded angel tax” has been abolished as the entrepreneur reacted to the Union Budget 2024. He added, “Hopefully, this is a 1st step in many that not only levels the playing field but tilts it in our favour, so we can build truly global companies from Day 1.” Entrepreneur Anupam Mittal appears as a ‘shark’ on Shark Tank India.



What is angel tax?

Angel tax is a provision under Section 56(2)(viib) of the Income Tax Act, 1961 which classifies investments from external investors received by startups as “income from other sources,” taxing them at a rate of 30%.

This has been abolished now.

Praising the budget, Mittal said, “LTCG has also been harmonised across pvt and public cos at 12.5%. Another shot in the arm for startup investors.”

Although, he said that he wanted more from the Budget, saying “Ye dil maange more (my heart wants more)”, adding that next on the list should be taxing esops only on exit and giving tax credit for startup investments.

If this is done, “Aag lag jaayegi"", he said.

",,,https://www.hindustantimes.com/business/shaadicoms-anupam-mittal-praises-budget-2024-but-says-ye-dil-maange-more-101721738193575.html
