Outlet,Title,Text,Prelim-Rating,Human-Rating,URL
hindustantimes.com,Union Budget 2024: Empowering unorganised workers,"The Economic Survey of 2021–2022 estimates that 43.99 crore people worked in various forms of informal employment in India during the 2019–20 fiscal year, making up a significant proportion of the country's unorganised workforce. Domestic workers stand out within this large group as a pertinent but frequently disregarded chunk of the population that diligently supports households all around the country.

The government may address the long-standing injustices faced by these individuals through the Interim Budget 2024, laying the groundwork for extensive social security reforms, as India is moving towards for its general elections in April. Shedding light on the provisions in the 2020 Social Security Code, we explore the possible challenges in the implementation of the social security funds intended for unorganised sector workers. Examining these obstacles, we make recommendations, especially with regard to the e-shram portal, to ensure that any new provisions effectively benefit individuals at the grassroots level.

India plans to establish a sizable social security fund for workers in the gig economy and unorganised sector. This fund was envisioned in the 2020 Social Security Code and marks a critical step towards achieving universal social security coverage.

India's labour reform initiatives, which aim to promote ethical labour practices and safeguard the rights of businesses and workers, include the Social Security Code of 2020. Out of the four codes, Social Security Code 2020 is essential for providing social security benefits to workers, including those in the gig economy and unorganised sector. It seeks to strike a balance between company and workers welfare by combining 29 labour statutes. The code is also anticipated to help India facilitate ease of doing business.

The Social Security Code of 2020 represents a substantial increase in coverage, especially for workers who were previously not covered by the laws in place, such as gig workers and platform workers in the rapidly growing e-commerce industry. The Code provides essential benefits like life and disability coverage, maternity benefits, and pensions to gig workers. It also includes the unorganised sector, temporary workers, and migrant workers who work beyond state lines, broadening the purview of social security programmes. Notably, another previous coverage gap has been filled as fixed-term contracts are now eligible for coverage. The objective of the Code is to guarantee complete social security coverage for a diverse workforce by streamlining compliance and using a consultative approach through inspector-cum-facilitators and uniform definitions.

The overarching goal is to bring together all current social security programmes—which address health, housing, education, old age, pensions, provident funds, and health—under a single, all-inclusive Social Security Fund. This consolidation aims to streamline administration, enhance accessibility, and ensure comprehensive coverage for all segments of the workforce. Through these concerted efforts, the government aims to create a more efficient and equitable social security system that effectively addresses the diverse needs of the workforce. In pursuit of this objective, the government launched e-shram portal, to get the number of unorganised workers in the country.

In 2021, the ministry of labour and employment established the e-shram portal to facilitate the registration of unorganised workers and building a comprehensive national database. It enables an unorganised worker to self-declare and register under 400 occupations across 30 major occupational areas on the platform.

The e-shram platform was launched in August 2021 and has since gathered data on over 293.3 million unorganised workers. By leveraging the data collected through the e-shram platform, and now encompassing information on unorganised workers, the government is in an adequate position to provide benefits to these workers. However, there remains the question of the reliability of this data and its accuracy in representing the diverse and dynamic nature of the unorganised labour sector.

According to the most recent data from the Telecom Regulatory Authority of India, India suffers from a significant digital divide. The country's total teledensity was 88.07%, while in rural areas it was just 60.10%. Based on a 2017–18 National Statistical Office (NSO) poll, only 18.4% of people aged 15+ were skilled in computer operation, while 22.9% were proficient in internet usage.

In the context of the online registration process for the Social Security Code, this digital gap comes across as a serious challenge, particularly for India's 93% unorganised labour force, which frequently works in poor circumstances for little pay. It's probable that people without cell phones don't have the digital literacy, which is needed to use the portal efficiently. To make things more difficult, employees who constantly alter their contact information may not be able to register because the process requires an active phone number connected to Aadhaar. Given the technological shortcomings related to Aadhaar authentication, requiring Aadhaar for social security benefits raises difficulties. Aadhaar linkage to benefits financed by the Consolidated Fund of India is restricted as a result of the Supreme Court's ruling in the Puttaswamy case, as government bodies and the Parliamentary Standing Committee on Labour have noted.

Moreover, the scheme only applies to individual workers who register; it does not allow for the inclusion of information on the workers' families or dependents. Workers who are 60 years of age or older are being excluded. The Shram Suvidha Kendra is the only organisation that authenticates workers for registration, which may result in exclusion while managing the database that contains information on over 43 crore people.

In order to ensure that all workers benefit from the planned provisions in Budget 2024, it is essential that these challenges be addressed. It is imperative that the digital divide in India be addressed. The Aadhaar requirements and low digital literacy provide challenges for the unorganised labour population. Furthermore, data inclusion and accuracy are also impacted. To improve accessibility and inclusion, a number of measures need to be taken. Some of these can include the following:

· Alternative government-issued ID cards should be recognised as a valid form of identity verification for workers.

· Flexibility and user-friendliness would be improved by enabling employees to register using any desired number and to change it as needed.

· Workers who encounter digital difficulties should be accommodated by enabling offline registration through registration camps and common service centers.

· Door-to-door campaigns, local events, and a dedicated helpline for portal-related concerns would all contribute to the simplification of the registration process and increasing awareness.

As next steps, the government can enhance its efforts to address the challenges outlined above and ensure a more accessible and inclusive social security system for all Indian workers. Through the implementation of these measures, the government may efficiently close gaps and establish a strong social security system that meets the varied requirements of the labour force.

This article is authored by Pooja Gupta, senior consultant and lead, Strategic Communications and Eshita Trivedi, communications assistant, Policy and Development Advisory Group.",,,https://www.hindustantimes.com/ht-insight/economy/union-budget-2024-empowering-unorganised-workers-101706708020962.html
hindustantimes.com,Budget 2024: Karnataka CM Siddaramaiah seeks AIIMS at Raichur,"Ahead of the Budget session of Parliament, Karnataka Chief Minister Siddaramaiah has urged the central government to allocate an All India Institute of Medical Science (AIIMS) in Raichur. Karnataka Chief Minister Siddaramaiah.(PTI)

Following a request put forth by Karnataka Minister NS Boseraju, the chief minister penned a letter to Union Finance Minister Nirmala Sitharaman.

On January 25, Karnataka's Minister of Minor Irrigation, Science, and Technology, NS Boseraju, formally petitioned the chief minister, seeking the establishment of AIIMS in Raichur.

""This demand aligns with our manifesto commitment and is a reflection of the aspirations of the people of the district. Raichur has witnessed a persistent 625-day-long Satyagraha led by various organizations and advocacy groups, emphasizing the crucial need for AIIMS in the region,"" the state government said in a release on Tuesday.

Recognized as an aspirational district by the central government, Raichur holds special significance under Article 371(J) of the Constitution, which

The state government said it had earlier, on two occasions--June and September 2023--addressed the Union Minister of Health and Family Welfare, underscoring the criticality of AIIMS for Raichur.

""In these communications, emphasis was placed on urging the Finance Minister of the Union Government to accord due consideration to this matter ahead of the 2024-25 Union Budget,"" the release added.

Meanwhile, the Budget Session will commence with the address of President Droupadi Murmu on Wednesday and subject to the exigencies of government business, the session may conclude on February 9.

Union Finance Minister Nirmala Sitharaman will present the interim Union Budget on Thursday.

The interim budget typically takes care of the fiscal needs of the intervening period until a government is formed after the Lok Sabha polls.

Earlier today, an all-party meeting, chaired by Parliamentary Affairs Minister Pralhad Joshi, was convened ahead of the Budget Session of Parliament. The meeting was held at the Parliament Library building.",,,https://www.hindustantimes.com/budget/budget-2024-karnataka-cm-siddaramaiah-seeks-aiims-at-raichur-101706609300242.html
hindustantimes.com,Union Budget 2024: Why Economic Survey won't be presented on January 31 this year,"Finance Minister Nirmala Sitharaman will be presenting the interim Union Budget 2024 on February 1, Thursday. One of the most significant part of Parliament's Budget session is the presentation of the Economic Survey on January 31. Chief Economic Advisor V Anantha Nageswaran along with Principal Economic Adviser Sanjeev Sanyal and Rajiv Mishra show the Economic Survey 2021-22, (PTI)

However, this year the Economic Survey will not be presented a day before the interim Budget is announced by the FM. The reason behind this is that this is not a full budget, but an interim budget being presented by the government.

What is the Economic Survey?

The Economic Survey is a document presented by the Centre a day before the Union Budget, and it is a comprehensive annual report which displays the performance of the Indian economy in the past fiscal year, highlighting the highs and lows for better insights for the future.

The Economic Survey is presented by the Chief Economic Advisor (CEA) on the eve of the Budget presentation, giving a highlight on how the previous budget worked and providing insights on what could come next for the Indian economy.

Why no Economic Survey on January 31?

Since this is not a full fledged Budget session, the Economic Survey will not be presented this year. In fact, no major announcements or changes in policy will be announced on February 1, since FM Sitharaman will only be presenting the interim Budget 2024.

The Lok Sabha elections 2024 are set to take place this year in April-May, which is why a full budget is not being presented by FM Sitharaman. A complete budget and the Economic Survey will be presented in July, when the results are declared and a new cabinet is appointed.

Since the survey document will not be out tomorrow, the Ministry of Finance released a report titled “Indian Economy – A Review"" on Monday, January 29, giving the top highlights in the Indian economy from the part 10 years.

Indian Economy-A Review states that India will become a $5 trillion economy the next 3 years and could reach $7 trillion by 2030. India is poised to surpass a GDP growth rate of 7.2% in FY24, outpacing the global economy’s struggle to achieve a growth rate exceeding 3%, the report states.

It is expected that Indian economy will see a growth of 7 percent in 2024 for the third consecutive year. India also holds the position of the third-largest fintech economy globally, after UK and USA.",,,https://www.hindustantimes.com/business/union-budget-2024-why-economic-survey-wont-be-presented-on-january-31-this-year-101706631638826.html
hindustantimes.com,"Budget 2024: Centre may hike PM Kisan payout to ₹9000, says report","The interim Budget 2024 will be presented by Finance Minister Nirmala Sitharaman on February 1. It is expected that the Centre will make some changes to their welfare scheme, including the Pradhan Mantri Kisan Samman Nidhi. The interim Budget 2024 will be presented on February 1 (File)(HT File)

While no major announcements are expected in the interim budget, the government might increase the PM Kisan scheme payout by 50 percent this year, from ₹6000 to ₹9000 per year, reported The Economic Times.

The ET report said that economists believe that the increase of the payout in the PM Kisan scheme for farmers is one of the three major social sector announcements expected during Union Budget 2024.

Further, economists also said during a poll that Centre's housing scheme - PM Awas Yojana - will be one of the prime focuses of the government during the Budget 2024 presentation.

According to last year's budget, the outlay of PM Kisan scheme was ₹60,000 crore. This is expected to see a 50 percent increase this year. Apart from welfare schemes, the Centre is expected to continue the push for capital expenditure, as private sector investment is yet to pick up across sectors, the report added.

The government ramped up capital expenditure by almost a third annually in the past three years, prioritizing spending on roads, ports and power plants. These sectors are also expected to see a boost during the upcoming Budget 2024 session.

All-party meeting ahead of Budget 2024

An all-party meeting has been called ahead of the presentation of the interim Budget 2024 presentation, to be convened on Tuesday by the Minister of Parliamentary Affairs, Pralhad Joshi.

It is a customary practice ahead of every session as leaders of different parties highlight the issues they want to raise in Parliament, and the government offers them a glimpse into its agenda and seeks their cooperation.

It must be noted that FM Sitharaman will only be presenting the interim Budget in the Parliament on February 1, while the complete Union Budget for the upcoming fiscal year will be presented after the Lok Sabha elections and the appointment of the new cabinet.

(With inputs from agencies)",,,https://www.hindustantimes.com/business/budget-2024-centre-may-increase-pm-kisan-payout-to-rs-9000-per-year-says-report-101706519836510.html
hindustantimes.com,Budget 2024 Highlights: Government convenes all-party meeting on Jan 30,"Finance minister Nirmala Sitharaman at the halwa ceremony to mark the commencement of the final stage of preparations for Interim Union Budget 2024 in New Delhi on January 24. (PTI)

Budget 2024 Highlights: Union Finance Minister Nirmala Sitharaman is set to present the budget for FY 2024-25 on Thursday, marking the final annual financial statement of the Narendra Modi government's second term. The traditional pre-budget ‘halwa’ ceremony was held on Wednesday, initiating a ‘lock-in’ period for officials involved in budget preparation to maintain confidentiality until its tabling in the Lok Sabha on February 1....Read More

This is the final budget of the Narendra Modi government's second term. The upcoming budget is deemed 'interim' as the government faces a general election in April-May.

The full budget will be presented in July by the incoming government, whether a re-elected or new administration. In India, the financial year starts on April 1 and ends on March 31 the following year.",,,https://www.hindustantimes.com/business/budget-2024-live-updates-interim-narendra-modi-government-january-29-101706498328842.html
hindustantimes.com,"Budget 2024 news: ₹20k cr to be allocated to PM Suryoday Yojana, says report","Budget 2024 highlight: The Union budget for financial year (FY) 2024-25 will be unveiled by finance minister Nirmala Sitharaman on February 1, in what will be her sixth consecutive budget, making her only the second finance minister (after Morarji Desai) to present six straight budgets. The upcoming budget, however, will be interim; this is because the government faces a general election this year, in April-May. The full budget for FY24-25 will be presented in July by the incoming government, whether new or re-elected....Read More

Also, this is the final budget of the Narendra Modi government's second term. The officials involved in its preparation are currently in a ‘lock-in’ period to maintain confidentiality of the final document, and will come out only after its tabling on February 1. Their ‘lock-in’ started immediately after the traditional ‘halwa’ ceremony, held on January 24 this year.

In India, a financial year begins on April 1, and ends on March 31 the following year.",,,https://www.hindustantimes.com/business/interim-budget-nirmala-sitharaman-live-updates-january-28-2024-101706415026931.html
hindustantimes.com,Budget 2024: What women entrepreneurs expect from FM Nirmala Sitharaman?,"Experts anticipate incentives for maternity leave benefits, an emphasis on skill training for young women, tax relaxations for women entrepreneurs and increased paid holidays for working mothers in the upcoming interim budget. Union Finance Minister Nirmala Sitharaman is scheduled to present the budget on February 1 ahead of the Lok Sabha elections. Union finance minister Nirmala Sitharaman during the Halwa ceremony as the final stage preparations for the Interim Union Budget 2024 commences, in New Delhi on Wednesday. (Ministry of Finance-X)

Follow- Comprehensive coverage of Union Budget 2024

What do women entrepreneurs expect from Union Budget 2024?

Radhika Dalmia, chairperson of FICCI Ladies Organisation (Kolkata chapter), stressed the importance of increasing the Rashtriya Swasthya Bima Yojana allowance and enhancing education benefits for girls, considering these measures crucial. She emphasised that strengthening financial inclusion, healthcare infrastructure, and prioritizing education, especially for girls, are vital for fostering a more inclusive India.



Saloni Verma, co-founder and chairperson of Sunshine Corporate Creches, discussed the impact of the Maternity Act 2017, making creche services and six months of paid maternity leave mandatory for companies with 50+ employees. Verma proposed financial incentives for smaller companies to afford maternity leave salaries and creche services, addressing concerns about reluctance to hire married young women and the skewed female ratio in most companies.



Jyoti Bhandari, founder and CEO of Lovak Capital, called for Budget 2024 to prioritise skill training for young women, offering vocational programs post-class 12. She urged the fulfilment of promises to empower women economically and encourage the evolution of ""Lakhpati Mahilas"" from Women’s Self Help Groups. Bhandari emphasised supporting successful women entrepreneurs from these groups by facilitating their transition into larger value chain-focused producer organizations. She advocated focusing on the role of women in agriculture and exploring their potential contributions to various non-farm sectors, contributing to India's goal of becoming a global economic force.

(Inputs from wires)",,,https://www.hindustantimes.com/business/budget-2024-what-women-entrepreneurs-expect-from-fm-nirmala-sitharaman-101706433821703.html
hindustantimes.com,Budget 2024 Highlights: What do business leaders expect from FM Sitharaman?,"Nirmala Sitharaman, Union minister for finance and corporate affairs along with the ministers of state for finance, Pankaj Chaudhary and Dr. Bhagwat Kishanrao Karad and the senior officials arrived at Parliament ahead of presenting the Union Budget 2023-24. (Hindustan Times)

Budget 2024 Highlights: The annual budget, this one for financial year (FY) 2024-25, will be presented by Union finance minister Nirmala Sitharaman on February 1, which, starting 2017, has been the date on which the budget has been tabled. However, this annual financial statement will be ‘interim’ as the government faces a general election this year, in April-May. The full budget for FY24-25 will be unveiled in July by the incoming government, whether new or re-elected....Read More

According to minister Sitharaman, the upcoming budget will primarily be be a ""vote on account"" before the general elections, ruling out any major announcements.

In India, a financial year begins on April 1, ending on March 31 the following year.

What is the union budget? Key Information

• The union budget is the central government's annual financial statement.

• It outlines the government’s proposed expenditures and revenues for the upcoming fiscal year.

• The union finance minister presents it in Parliament.

• It covers the next financial year - the period from April 1 to March 31 of the following year.

• Serves as a comprehensive document outlining the government’s economic and fiscal policies for the next fiscal year.

• Includes details about proposed expenditures, revenues, liabilities, and welfare schemes.

• It is a crucial tool for financial planning and policy-making.",,,https://www.hindustantimes.com/business/budget-2024-expectations-live-date-time-income-tax-fm-nirmala-sitharaman-latest-updates-27-january-2024-101706328148092.html
hindustantimes.com,"Budget 2024 Highlights: After Morarji Desai, Sitharaman only 2nd FM to present budget 6 times in a row","FILE: Union finance minister Nirmala Sitharaman speaks in the Lok Sabha during the second phase of the Budget Session of the Parliament, in New Delhi. (ANI)

Union finance minister Nirmala Sitharaman is poised to present the interim budget for the fiscal year 2024-25 on February 1. The full budget for the same fiscal year will be unveiled after the formation of the new government following the 2024 general elections. In her sixth union budget presentation on February 1, FM Sitharaman said that it would primarily be a ""vote on account"" before the general elections, ruling out any major announcements. She emphasised that such interim budgets typically do not include significant announcements, and the public will have to await the new government's presentation of the comprehensive budget in July 2024....Read More

Follow - In-Depth Coverage of Budget 2024

What is the union budget? Key Information

• The union budget is the central government's annual financial statement.

• It outlines the government’s proposed expenditures and revenues for the upcoming fiscal year.

• The union finance minister presents it in Parliament.

• It covers the next financial year - the period from April 1 to March 31 of the following year.

• Serves as a comprehensive document outlining the government’s economic and fiscal policies for the next fiscal year.

• Includes details about proposed expenditures, revenues, liabilities, and welfare schemes.

• It is a crucial tool for financial planning and policy-making.",,,https://www.hindustantimes.com/business/budget-2024-expectations-live-date-time-income-tax-fm-nirmala-sitharaman-latest-updates-26-january-2024-101706247170028.html
hindustantimes.com,Budget 2024 highlight: What salaried class expects from FM Sitharaman?,"Jan 25, 2024 4:48 PM IST

Hyder Khan, CEO of Godawari Electric Motors, says that he is eagerly anticipating the upcoming budget with optimism and a fervent hope for increased support towards the electric mobility sector.

“The extension and enhancement of the FAME (Faster Adoption and Manufacturing of Hybrid and Electric Vehicles) scheme would be instrumental in propelling India towards a sustainable and eco-friendly future. Substantial subsidies for electric vehicles and related infrastructure would not only incentivize consumers but also bolster the growth of our industry.”

He adds: ""These measures will not only promote cleaner transportation but also stimulate innovation and job creation. I look forward to a budget that recognizes the pivotal role electric mobility plays in achieving environmental goals and economic development, and I trust that the government will continue to foster a conducive ecosystem for the electric vehicle industry to thrive.""",,,https://www.hindustantimes.com/business/union-budget-nirmala-sitharaman-live-updates-january-25-2024-101706154940913.html
