Outlet,Title,Text,Prelim-Rating,Human-Rating,URL
thehindu.com,Budget 2024 key takeaways in charts,"Union Finance Minister Nirmala Sitharaman presented the Union Budget for the Financial Year 2024-25 on July 23, 2024, her seventh consecutive Budget presentation. This is the first Budget during Prime Minister Narendra Modi-led government’s third term in office.



People of India have reinforced their faith in the government led by Prime Minister Narendra Modi and re-elected it for the third term, she said, while presenting the Budget in Lok Sabha. India’s economic growth continues to shine while the global economy is still in the grip of policy uncertainty, Sitharaman added.

The country’s inflation continues to be stable and is moving towards 4 per cent, and core inflation stands at 3.1 pc.

The finance minister announced nine priorities in the Union Budget 2024-25 for generating ample opportunities in the economy. The nine priorities include productivity, jobs, social justice, urban development, energy security, infrastructure, innovation and reforms.

Here are the charts that show key numbers from the Union Budget 2024-25:

Receipts and Expenditure

The Finance Minister said that the Revised Estimate of the total receipts other than borrowings is ₹32.07 lakh crore. The Revised Estimate of the total expenditure is Rs 48.21 lakh crore.

The government has retained ₹11.11 lakh crore for capital expenditure, not changing from the Interim Budget 2024-24 presented back in February

Rupee comes from

Borrowings and other liabilities account for the largest avenue from where the Budget money comes, followed by income tax, GST & other taxes, and corporation tax.

Rupee goes to

When it comes to expenditure, the highest amount goes towards States’ share of taxes and duties - 21%. In the Interim budget presented earlier this year, the major share of expenditure was marked to paying interest and the money given to the states, accounting for 20 per cent each of the total expenditure.

State-wise allocation of central taxes and duties

The Union Government had ₹1247211.28 crores of Union taxes and duties to distribute to the states. In statement showing the state-wise distribution of net proceeds of Union Taxes and Duties for Budget Estimates 2024-25, Uttar Pradesh receives the highest share at around 18% with ₹223737.23 crores.

Major expenditures

This year’s total budget expenditure amounts to 48.21 lakh crore rupees. Of this, a large part went to central sector schemes and other central sector expenditure - 30.07 lakh crore. Central sector scheme expenditure involves expenditure related to economic services, general services, subsidies, social services and others.

Other central expenditure involves interest payments, payments to autonomous bodies and others. Establishment expenditure involves the centre’s expenses for paying salaries, pensions and other payments. Finance commission grants and other transfers fall under transfers to states.

Allocation to ministries

The government allocated an outlay of ₹6,21,940.85 crore for defence for FY25, which is the highest among all the Union ministries. The total allocation comes out as approximately 12.90 per cent of the total budget of Union of India. In the interim budget, the outlay was pegged at ₹6,21,540.85 crore.

Allocation for major schemes

The Union Budget listed the allocations for core welfare schemes that drive socio-economic development.

Railways

The allocation to the ministry of railways in FY25 from the total expenditure budget of Rs. 48,20,512.88 lakh crores, is Rs. 2,55,393 lakh crores which is around 5.3% of the total expenditure.

On viewing the railway budget at a glance, the net revenue in FY ‘25 is budgeted to be at ₹2,800 crores, as compared to the revised estimate of ₹2,000 crores in FY ‘24. While the earnings from freights in FY ‘25 is estimated (₹1,80,000) to be similar to the previous year’s budgeted estimate of ₹1,79,500, the earnings from passengers is estimated to be ₹80,000 crores in FY ‘25, which is around 9.5% higher than previous year’s revised estimate of ₹73,000 crores, as shown in the graphs below.",Left,,https://www.thehindu.com/business/budget/budget-2024-key-takeaways-in-charts/article68435446.ece
thehindu.com,"Budget 2024: West Bengal deprived, Budget politically biased says Mamata","Alleging that West Bengal has been deprived in the Budget presented by Union Finance Minister Nirmala Sitharaman, the State’s Chief Minister Mamata Banerjee on July 23 dubbed it as a “politically biased Budget”.

“It is an anti-poor, anti-people, and politically biased Budget,” Ms. Banerjee told journalists in her chamber in the State Assembly. The Trinamool Congress chairperson accused the Bharatiya Janata Party (BJP) led National Democratic Alliance (NDA) government of “being envious of West Bengal” and said that the State received a “big zero” in the budgetary allocations.



“This budget is totally directionless, anti-people, with no vision, only a political mission in mind. I don’t see any light. It is dark, dark, and dark,” Ms. Banerjee said.

The Chief Minister raised questions on Centre’s proposal to provide flood assistance to neighbouring Sikkim. In her Budget speech, Ms. Sitharaman referred to devastating flash floods and landslides that wreaked havoc in Sikkim and added that the government will provide assistance to the State. ”If Sikkim gets and West Bengal is deprived. This is not good,” the Chief Minister said. She said that people of Darjeeling and Kalimpong should bear this in mind that while seeking votes the BJP promises everything but does not deliver. The BJP had won most of seats in north Bengal including Darjeeling Lok Sabha seat.

In her Budget speech the Finance Minister referred to the Amritsar Kolkata Industrial Corridor, and said the government will support development of an industrial node at Gaya. The Chief Minister said she had made provisions for the Dankuni Amritsar corridor long ago in 2009 and what the Finance Minister was promising was old wine in a new bottle.

Along with the Chief Minister, party general secretary Abhishek Banerjee reacted to the Budget saying that instead of tackling urgent issues like unemployment, rising prices and growing inflation, the “BJP has crafted a budget to bribe its coalition partners and buy time before the government implodes”. Mr. Banerjee also highlighted that Bengal has been constantly deprived by this BJP government at the Centre. “Has there been a positive outcome of 12 BJP MPs who are elected from Bengal? No! The net result is zero because Bengal has been constantly tortured & deprived. What Suvendu Adhikari said a few days ago Jo humare saath, hum unke saath [We are with those who are with us] has been proved today,” he said.



The Finance Minister in the Budget also referred to West Bengal while stressing on a plan, Purvodaya, “for the all-round development of the eastern region of the country covering Bihar, Jharkhand, West Bengal, Odisha and Andhra Pradesh”.

TMC’s Rajya Sabha MP Sagarika Ghose spoke on similar lines and said they staged a walkout from the Upper House of Parliament in protest.

“This is a failed budget. It is to bribe two of the alliance partners - Bihar and Andhra Pradesh - not a Union Budget. This budget is bribing coalition partners before this government implodes,” she told reporters outside Parliament.

“We in the TMC have protested against this anti-Bengal budget. The TMC walked out of the Rajya Sabha. This is anti-federal. You cannot sacrifice the federal spirit at the alter of politics. It is ethically repugnant, constitutionally immoral and economically ruinous,” Ghose said.

Rajya Sabha MP Saket Gokhale alleged that there is an “open and shameless” discrimination against West Bengal in the budget.

“Open and shameless discrimination yet again in this Union Budget. Union Govt excludes only Bengal from flood relief and reconstruction funds,” he said in a post on X.

“Giving funds to other states while intentionally ignoring and singling out the people of Bengal is yet another revenge for BJP’s pathetic performance in elections,” Gokhale added.



“West Bengal contributes significant revenues to the Union but faces pathetic targeting and exclusion yet again in the Union Budget,” the TMC leader said.

Another Rajya Sabha MP of the party, Sushmita Dev, said central funds amounting to Rs 1.6 lakh crore are due to West Bengal and questioned how the budget exercise was being carried out without the census being held.

“You are calling the budget historic, but he is a king who does not know what the population is. There has been no census since 2011. If you do not know the exact numbers, how are you going to make the budget?” she asked.

(with PTI inputs)",Left,,https://www.thehindu.com/business/budget/budget-2024-west-bengal-chief-minister-mamata-banerjee-dubs-union-budget-politically-biased-anti-poor/article68436543.ece
thehindu.com,"Budget 2024: Not a word of ‘Telangana’, says Irrigation Minister Uttam Kumar Reddy","Telangana Irrigation and Civil Supplies Minister, N. Uttam Kumar Reddy has criticised Union Finance Minister Nirmala Sitharaman for ignoring Telangana in the Union Budget 2024 presented on Tuesday.

Budget not for people, but to please BJP’s allies

Mr. Reddy said that the budget was politically motivated and drafted not for the people but to please Bharat Janata Party’s (BJP) allies: Janata Dal (U) and the Telugu Desam Party (TDP). While Bihar was given financial aid of ₹41,000 crore, Andhra Pradesh got ₹15,000 crore and other sops, including funds for completion of the Polavaram project. Congress-ruled States, especially Telangana, were totally neglected, he said.

“This is the 11th budget after the formation of Telangana in 2014. However, the new State remained neglected by the Centre. For the first time since 2014, a separate chapter titled ‘Andhra Pradesh Reorganization Act’ was incorporated in the budget speech, but the Finance Minister did not mention the word ‘Telangana’ in her entire speech of 58 pages and 14,692 words,” he said.

Budget 2024 LIVE Updates

Telangana ministers submitted various applications in the last seven months seeking funds

The Minister condemned Ms. Sitharaman for completely skipping the mention of Telangana when she spoke about the Andhra Pradesh Reorganization Act in her budget speech. “While we are not against the Centre giving special funds to Andhra Pradesh, we strongly condemn its discrimination towards Telangana. Led by Chief Minister A. Revanth Reddy, a delegation of Telangana ministers submitted various applications to all ministries in the last seven months seeking funds for various projects. But our pleas were completely ignored. The BJP Government promised to fund the Polavaram project, but gave no assurance in her budget speech today of giving funds for Palamuru Ranga Lift Irrigation Scheme,” he said.

“We are still hopeful that the BJP Government at the Centre will provide the funds for the Palamuru Ranga Reddy Project as assured to us by the then Union Water Resources Minister Gajendra Singh Shekhawat,” he said.

He ridiculed the Finance Minister’s claim that the BJP Government was making ‘concerted efforts to fulfil the commitments in the Andhra Pradesh Reorganization Act’. “People of Telangana have been waiting for the last ten years for the BJP Government to honour the promises made in the AP Reorganisation Act. The Railway Coach Factory in Kazipet, a steel factory at Bayyaram, funds for Tribal University, funds for high-speed road and rail connectivity, and other promises made in the Act remained unfulfilled.

“If Bihar and Andhra Pradesh deserved special funds, then why is Telangana being deprived of such treatment?” he asked.

No mention of backward regions in Telangana

Uttam Kumar Reddy said that the Finance Minister selectively sanctioned grants for the backward regions of Rayalaseema, Prakasam, and North Coastal Andhra but decided to skip the mention of the backward regions of Telangana. “While we welcome the Finance Minister’s announcement that commitments made in the AP Reorganisation Act will be fulfilled, we expect that commitments made with both Telangana and Andhra Pradesh are fulfilled,” he said.

He said eight BJP MPs, including two Union Ministers - G Kishan Reddy and Bandi Sanjay - failed to get a decent share for Telangana in the Union Budget.

He said that the Union Budget was highly disappointing for Telangana as it deprived the State of its share in resources and welfare schemes.",Left,,https://www.thehindu.com/business/budget/budget-2024-not-a-word-of-telangana-says-irrigation-minister-uttam-kumar-reddy/article68436403.ece
thehindu.com,"Budget 2024 for education and employment: FM Sitharaman says ₹1.48 lakh cr allocated for education, employment, skill","The Union Budget for 2024-25 will provide ₹1.48 lakh crore for education, employment and skilling in the country.

Presenting the Budget in the Lok Sabha, Finance Minister Nirmala Sitharaman said it will focus on employment, skilling, MSMEs and the middle class.



She added that the government has extended the PM Garib Kalyan Anna Yojana for five years which is benefiting 80 crore people of the country.

As mentioned in interim budget, there is a need to focus on poor, women, youth and farmers, the Minister said.

Ms. Sitharaman added that people have given unique opportunity to the Modi government to take India on the path of strong development, and all-round prosperity.

New centrally-sponsored scheme to skill 20 lakh youth over 5 years

The government on Tuesday announced a new centrally-sponsored scheme for skilling 20 lakh youth over the next five years.

The Union Finance Minister said that model skilling loan scheme will be revised to facilitate loans up to Rs 7.5 lakh.

As part of boosting skilling efforts, 1,000 ITIs will be upgraded on the hub-and-spoke model. Besides, the government will provide financial support for loans up to ₹10 lakh for higher education in domestic institutions.

Ms. Sitharaman said the new centrally-sponsored scheme for skilling in collaboration with states and industry will train 20 lakh youth over a period of five years.",Left,,https://www.thehindu.com/business/budget/budget-2024-148-lakh-cr-allocation-for-education-employment-skill-says-fm-nirmala-sitharaman/article68435611.ece
thehindu.com,Budget 2024: Kerala’s dream of AIIMS-like institution dashed again,"Kerala’s much-anticipated and decades-long dream of having an All India Institutes of Medical Sciences (AIIMS)-like institution on its soil was dashed yet again when the proposal found no mention in the Union Budget 2024-25 presented by Finance Minister Nirmala Sitharaman on July 23.



Unlike in the previous years, the anticipation this year that the project might finally come through was intense, particularly because of the presence of two Union Ministers of State from Kerala at the Centre, one of whom is the BJP’s first-ever elected MP from the State.

On July 22 too, the topic of approving an AIIMS-like institution for Kerala had been raised in Rajya Sabha by John Brittas, MP.

However, not just AIIMS, no major proposals for the nation’s health sector seemed to figure in the Union Budget 2024-25, other than the exemption of three more cancer drugs from customs duties.

The total allocation for the nation’s health sector in the Budget is ₹89,287 crore. The Ayushman Bharat Pradhan Mantri Jan Arogya Yojana has an allocation of ₹7,500 crore and the health coverage under the scheme has been extended to accredited social health activists (ASHA), anganwadi workers and helpers.

AIIMS was established as an autonomous institution in New Delhi under the Act of Parliament in 1956 and is today the apex medical institution in the country.

It is only after 2012 that the Centre began setting up AIIMS-like institutions across the country, under the Pradhan Mantri Swasthya Suraksha Yojana (PMSSY), a scheme announced in 2003, with the objectives of correcting regional imbalances in the availability of affordable/reliable tertiary healthcare services as well as augmenting facilities for quality medical education in the country.

There are today 22 AIIMS-like institutions in the country, some of which are operational, while the rest are in various phases of development.

A political and emotional issue

Over the past decade, having an AIIMS-like institution has become a political as well as emotional issue for Kerala and the feeling that the Centre was wilfully denying the State its due has been building.

The issue took on much political colour and was a much-debated topic of discussion in the State in the run up to the 2024 Lok Sabha elections as well as the post-election debates, with many prominent MPs engaging in a war of words over “unfulfilled promises.”

While the State government seemed to have finalised Kinalur in Kozhikode as the ideal location to establish an AIIMS-like institution, Thiruvananthapuram, Palakkad and lately, Kasaragod have all been vying for the privilege.

Health Minister Veena George had informed the State Assembly in June that the Centre had accepted Kerala’s choice of Kinalur in Kozhikode to be the site for the proposed AIIMS-like institution but that the final approval on the project was still being awaited.",Left,,https://www.thehindu.com/business/budget/budget-2024-keralas-dream-of-aiims-like-institution-dashed-again/article68436545.ece
thehindu.com,"Union Budget 2024-25: Land reform measures to be undertaken consulting States, says Finance Minister in Budget speech","In her seventh budget speech, Finance Minister Nirmala Sitharaman said that the government would formulate an economic policy framework to delineate the strategy for sustaining high growth with next generation reforms. This is to cover all factors of productions, land, labour and capital. For this, collaboration with Centre and States is required, the Finance Minister said.



A significant part of a 50 year interest free loan is proposed to be earmarked to work with the States on a slew of reforms. This includes land related reforms in both urban and rural areas, which covers land administration, planning and urban planning and building bye-laws. Rural land related actions will include assignment a unique Aadhaar for all lands, digitisation of terrestrial maps, survey of lands, and establishment of land registry. Land records in urban areas are also to be digitised to help improve the finances of urban bodies in the country.

Ms. Sitharaman also announced that Digital Public infrastructure will be developed for agriculture. After a successful pilot project, we will partner with States to cover farmers and their lands in three years, she said, adding that it will be taken up in 400 districts this year. The porject is expected to cover six crore farmers.

Further, she said that the government will provide support under the Accelerated Irrigation Programme and other sources for projects with an estimated cost of Rs 11,500 crore.",Left,,https://www.thehindu.com/business/budget/budget-2024-land-reform-measures-to-be-undertaken-consulting-states-says-finance-minister-in-budget-speech/article68435841.ece
thehindu.com,Budget 2024: FM Nirmala Sitharaman says fiscal deficit for FY25 estimated to be 4.9% of GDP,"Finance Minister Nirmala Sitharaman, in her Budget speech on July 23, said the fiscal deficit for 2024-25 is estimated at 4.9% of GDP.

Presenting the Union Budget for 2024-25, she said the government aims to reach a 4.5% fiscal deficit in 2025-26.

Click here for the Union Budget 2024 updates, highlights

The Finance Minister said gross and net market borrowing is pegged at ₹14.01 lakh crore and ₹11.63 lakh crore, respectively, in FY25.

Net tax receipts are estimated at ₹25.83 lakh crore in FY25 while the total receipts are pegged at ₹32.07 lakh crore.

Total expenditure is estimated at ₹48.21 lakh crore in FY25, she added.

It may be recalled that the interim Budget, presented in February 2024, had pegged fiscal deficit, which is the difference between the government expenditure and income, at 5.1% for FY25 against 5.8% in the last fiscal year.

In her speech, Ms. Sitharaman also said the government plans to launch ‘NPS Vatshalya’ to provide pension contributions by parents and guardians.",Left,,https://www.thehindu.com/business/budget/budget-2024-fm-nirmala-sitharaman-says-fiscal-deficit-for-fy25-estimated-to-be-49-of-gdp/article68436034.ece
thehindu.com,Budget 2024 Highlights on income tax: FM Sitharaman revises personal income tax slabs; taxation rates remain unchanged,"Finance Minister Nirmala Sitharaman in her seventh Budget speech on July 23 revised the tax slabs under the new regime. She told the House that as a result of these changes, a salaried employee would be able to save up to ₹17,500 in income taxes.

Click here for the Union Budget 2024 updates, highlights

Whilst the rate of taxation remains unchanged, the size of each of the slabs, excluding the initial zero to ₹3 lakh, remains unchanged. The erstwhile slab of ₹3 lakh to ₹6 lakh would now be expanded to ₹3 lakh to ₹7 lakh. However, the rate of taxation, that is 5%, remains unchanged. Similarly, the other slabs, that is, ₹6 to 9 lakhs, ₹9 to 12 lakhs, ₹12-15 lakhs and thereby beyond, would be revised to ₹7-10 lakhs, ₹10-12 lakhs, ₹12-15 lakhs and thereby beyond.

Budget 2024-25: Taxes

Earlier, the Finance Minister further placed increasing the standard deduction for salaried employees from current ₹50,000 to ₹75,000 under the new tax regime.

Ms. Sitharaman further announced deduction in family pension for pensioners to be enhanced from ₹15,000 at present to ₹25,000. She held the measure would provide relief to about 4 crore salaried and pensioner individuals.

Concluding her speech, the Finance Minister told the House that because of the taxation measures announced today, ₹37,000 crore would be foregone, which entails ₹29,000 in direct taxes and ₹8,000 in indirect taxes. However, with a realisation of ₹30,000 crore expected, the total foregone amount would stand at ₹7,000 crore.",Left,,https://www.thehindu.com/business/budget/budget-2024-fm-sitharaman-revises-income-tax-slabs-rates-remain-unchanged/article68435911.ece
thehindu.com,Union Budget 2024: Shares of shrimp products makers in heavy demand after Budget allocation,"Shares of producers and exporters of seafood products' firms jumped on July 23 after Finance Minister Nirmamala Sitharaman said the government will provide finance for shrimp farming and marketing.

Presenting the Union Budget for 2024-25, Sitharaman said that the government has reduced the basic customs duty on shrimp to 5%.



The stock of Zeal Aqua soared 9.27%, Kings Infra Ventures surged 8.15%, Coastal Corp climbed 7.55%, Apex Frozen Foods zoomed 7.51% and Waterbase jumped 5.51% on the BSE.

The government will bring a National Cooperation Policy for the overall development of the country, the finance minister said.

She said the Centre will promote digital public infrastructure for agriculture in partnership with states, while the Jan Samarth-based Kisan Credit Card scheme will be introduced in five states.

Also, the government will provide finance for shrimp farming and marketing, she added.



""Finance Minister Nirmala Sitharaman has extended the finance to shrimp production and marketing for the overall development of the industry. Direct beneficiaries to this announcement being Waterbase, Avanti Feeds, Apex Frozen Foods,"" T Manish, Research Analyst at SAMCO Securities, said.",Left,,https://www.thehindu.com/business/budget/budget-2024-shares-of-shrimp-products-makers-in-heavy-demand-after-budget-allocation/article68436102.ece
