Outlet,Title,Text,Prelim-Rating,Human-Rating,URL
hindustantimes.com,Union Budget 2024: EV industry seeks incentives and tax rationalisation,"With Finance Minister Nirmala Sitharaman scheduled to present the Union Budget 2024 on July 23, India's electric vehicle (EV) sector is optimistic about potential announcements that could spur industry growth, ANI wrote. The Faster Adoption and Manufacturing of Hybrid and Electric Vehicles in India (FAME India) Scheme, introduced in 2015, promotes electric and hybrid vehicles in India and has completed two terms (Representative Image)

What does the EV industry want from the Union Budget 2024?

The industry expects the introduction of the Faster Adoption and Manufacturing of Hybrid and Electric Vehicles in India (FAME) - III, funds for public charging infrastructure, incentives for localising components, and reduction of GST on EVs, among others.



“The industry hopes the FAME scheme will expand to include private buses and commercial vehicles (CVs), which have so far been limited to State Transport Undertakings (STUs),"" Aryaman Tandon, Managing Partner at Praxis Global Alliance for the Mobility sector told ANI. ""Reducing customs duties on imported EV components and supporting local R&D in battery technology, as seen in the last budget, will further accelerate local manufacturing and create jobs.”

EV adoption increased by 48% in 2023 primarily due to government subsidies like FAME-II, ANI quoted Nimish Trivedi, the founder & CEO of Evera, as saying.



The FAME Scheme, initially introduced in 2015, promotes electric and hybrid vehicle adoption in India and has completed two terms; FAME-I and FAME-II.

“We expect the government to consider reducing GST rates on EV components and batteries from the current 18 percent to 5 percent,” Mukesh Taneja, CEO and Co-Founder at GT FORCE told ANI. ""This tax rationalisation would help offset potential price increases resulting from the conclusion of subsidy programmes and keep EVs affordable for the masses.""

Why does India's EV industry want all these new reforms?

All this comes at a time when global electric vehicle sales have been slowing down. India is no exception.

India’s EV two-wheeler market has saw registrations falling by 27% in May compared to the previous year, according to a Mint report.



This led Ola Electric founder and CEO Bhavish Aggarwal to write a post on X (Formerly Twitter) advising EV companies to invest more on the product and its supply chain and lesser on its marketing, or what he called as “cute” ads.

Capital costs and a shortage of rapid-charging stations are major reasons for slowing EV demand worldwide, ANI wrote, citing Goldman Sachs.",,,https://www.hindustantimes.com/budget/union-budget-2024-ev-industry-seeks-incentives-and-tax-rationalisation-101720948962807.html
hindustantimes.com,Union Budget 2024: Government may push for increased privatisation of PSU banks,"The government may bring new amendments to the Banking Regulation Act as well as some other laws during the Union Budget 2024 session which can lead to the government's shareholding in public sector banks (PSBs) dipping below 51%, PTI wrote, citing anonymous sources. In April 2020, the government consolidated 10 PSBs into four, reducing the total number of PSBs to 12 from 27 in March 2017. (Reuters)

What are the bank laws that may be amended?

Amendments in other acts such as the Banking Companies (Acquisition and Transfer of Undertakings) Act, 1970, and the Banking Companies (Acquisition and Transfer of Undertakings) Act, 1980 may also happen because amendments are needed to increase privatisation, as these are the same laws that led to nationalisation in the past.



The government had earlier proposed amendments to these laws for the 2021 winter session, with Finance Minister Nirmala Sitharaman announcing the privatisation of public sector banks while presenting the Union Budget 2021, but these could not go through.

""Other than IDBI Bank, we propose to take up the privatisation of two PSBs and one general insurance company in 2021-22,"" she said.

In April 2020, the government consolidated 10 PSBs into four, reducing the total number of PSBs to 12 from 27 in March 2017.

What were some of India's bank mergers of the past?

The United Bank of India and Oriental Bank of Commerce were merged with Punjab National Bank, making the new entity, India's second-largest PSB.



Syndicate Bank was merged with Canara Bank, Allahabad Bank with Indian Bank, and Andhra Bank and Corporation Bank were merged with the Union Bank of India.

Bank of Baroda merged Vijaya Bank and Dena Bank with itself in 2019.

SBI merged five of its associate banks, including State Bank of Patiala, State Bank of Bikaner and Jaipur, State Bank of Mysore, State Bank of Travancore, State Bank of Hyderabad, and also Bharatiya Mahila Bank. This was in April 2017.

The Union Budget 2024 will be presented on July 23, with the parliamentary session going on from July 22 to the passage of the Finance Bill on August 12.

",,,https://www.hindustantimes.com/budget/union-budget-2024-government-may-push-for-increased-privatisation-of-psu-banks-101720850987178.html
hindustantimes.com,PM Modi holds key meet with top economists ahead of Budget 2024,"Prime Minister Narendra Modi met economists on Thursday for a discussion that centered around policy measures required to boost inclusive growth with a medium-term road map to make India the third-largest economy in the world, which will in turn pave the way for achieving the aim of Viksit Bharat (developed India) by 2024, three people aware of the development said. Prime Minister Narendra Modi and finance minister Nirmala Sitharaman address a meeting with economists ahead of the Union budget which will be presented on July 23, in New Delhi on Thursday. (ANI)

The conversation, ahead of the Union Budget 2024-25, was largely about accelerating efforts to rapidly alleviate poverty by keeping inflation under check, deepening and broadening welfare measures, and creating employment opportunities through investments and skilling, the people said, asking not to be named.

In a social media post on X, the Prime Minister confirmed the development. “Earlier today, interacted with eminent economists and heard their insightful views on issues pertaining to furthering growth,” he said.



The meeting, held at Niti Aayog, is crucial as the government is likely to present the Modi government’s vision for the next five years in the budget.

Speaking in the Rajya Sabha, Modi on July 3 stressed that the government will accelerate and expand the pace of reforms undertaken in the last 10 years and those efforts would witness newer heights and depth in terms of saturation in delivery of basic services.

The meeting on Thursday was attended Union finance minister Nirmala Sitharaman, sectoral experts, economists, and senior officials. Sitharaman is scheduled to present the budget for FY25 in the Parliament on July 23.

Niti Aayog vice chairman Suman Bery was a part of the meeting, as were planning minister Rao Inderjit Singh, chief economic advisor V Anantha Nageswaran, economists Ashok Gulati and Surjit Bhalla, and banker KV Kamath.



“This budget will be the first document providing a road map transform India into a $30 trillion developed economy by 2047 for projected 165 billion citizens,” one of the people aware of the details said. “It will provide a template for a future-ready India.” The identified focus areas are rural development, agricultural growth, investments in infrastructure, health, housing, sanitation, education, skilling, security and trade, he added.

The PM will take inputs of experts and economists for accelerating economic growth and social reforms, a second person said. “The idea is to make lives of citizens easy and prosperous,” he added. The suggestions centered around further consolidating the fiscal position, continuing public expenditure to boost growth, giving impetus to ease of living, and focussing on farmers, women, youth, middle-classes, and the vulnerable, he said.

Economic development to tackle hunger and poverty eradication was also proposed in the meeting, a third peson said.

On July 3, in the Rajya Sabha, Modi said: “The next five years will be decisive years for the fight against poverty... and this country will be victorious in this fight against poverty. I can say with confidence based on the experience of the last 10 years.”

Addressing the joint session of the Parliament on June 27, President Droupadi Murmu -- delivering a customary speech put together by the government -- said: “This budget will be an effective document of the government’s far-reaching policies and futuristic vision. Along with major economic and social decisions, many historic steps will also be seen in this budget.”",,,https://www.hindustantimes.com/india-news/pmmodi-holds-key-meet-with-top-economists-ahead-of-budget-2024-101720724418676.html
hindustantimes.com,Union Budget 2024: Expectations for Education Sector,,,,https://www.hindustantimes.com/web-stories/education/union-budget-2024-expectations-for-education-sector-101720781344648.html
hindustantimes.com,Union Budget 2024: Will centre meet rising demands of the education sector? Here’s what experts expect in Budget 2024,"Finance Minister Nirmala Sitharaman will present the Union Budget 2024 on July 23. Even as anticipation grows among citizens on the economic changes to be brought in by the latest budget, all eyes will be riveted on how the central government plans to meet the rising demands of the education sector, especially at a time when it has been drawing flak over the recent controversies involving crucial entrance examinations and accompanying features. Union Finance Minister Nirmala Sitharaman will be presenting the Budget 2024 on July 23. What will be in store for the education sector? Here is what experts have to say. (ANI image)

Clearly, the Budget 2024 will be an acid test for the Modi Government.

Meanwhile, expectations are rife with regard to the likely changes and alternatives to be brought in by the new budget. Experts across academic circles aired their views and opinions to Hindustan Times Digital.

Need for GST exemption

Prateek Maheshwari, the Co-Founder of PW and Chair of the India EdTech Consortium (IEC), said that students hailing from Below Poverty Line (BPL) and Low-Income Groups should receive 100 percent GST exemption from all educational expenses, be it test-prep or job-oriented skill courses. He pointed out, “The 18 percent tax slab is extremely high for a need as basic as education. The government should derive a mechanism to enable more students in receiving quality education, and at the same time, make it affordable.”



“We welcome the GST exemption related to student housing, however, it is important to remove the ambiguities. It continues to be a grey area, given the student needs to continuously reside in that accommodation for a period of 90 days. While the aim is to benefit the students, this exemption lacks clarity on execution in terms of timeline,” said Maheshwari.

Prioritising teacher training and digital infrastructure

Prajodh Rajan, the Co-Founder & Group CEO of Lighthouse Learning (formerly EuroKids International), said that a significant boost in education spending is crucial to unlock India's true potential. Emphasizing a multi-faceted strategy, Rajan said, “We need to prioritize teacher training and development programmes as well as strengthen digital infrastructure to facilitate seamless learning experiences. Investing in upskilling our educators with the latest pedagogies and technologies is crucial for delivering high-quality education.”

He also underlined the importance of improving early childhood education infrastructure, which includes establishing more high-quality preschools, particularly in underserved communities. “Early education lays the foundation for lifelong learning, and ensuring accessibility for all is vital. A forward-thinking budget that prioritizes education will empower our youth, drive economic growth, and foster social progress. We are optimistic that the government will recognize these imperatives and create an environment where every student can thrive,” Rajan added.



Introducing student-friendly education loans

Shweta Sastri, the Managing Director of Canadian International School, Bangalore, stressed that a substantial portion of the student community depends on educational loans to pursue their dream course. She said, “Encouraging more students to take up their course of interest with lower interest rates on such loans is essential for their optimal growth and development.”

She pointed out that the government should announce measures to further promote the integration of technology in education and to build future-ready skills in students which

Besides, improving internet connectivity infrastructure across the nation that promotes last-mile access was a point put forth by Sastri. She said, “Looking ahead, we must strive to ensure that the learning experience remains meaningful and enriching. It is important to nurture, challenge, and empower all students to be successful in whatever they choose in life.”

Expanding access to education and technology in underserved areas

Niru Agarwal, the Trustee of Greenwood High International School said that the upcoming budget should address core aspects of education to enhance the quality of learning, improve teacher professional skills, and build robust infrastructure. “While new educational policies have identified many path-breaking initiatives, we urge the government to focus on expanding access to education and technology, particularly in rural and underserved areas. We must build the right combination of Digital, Physical, and on-the-job classroom infrastructure that will improve the efficacy of learning,” Agarwal said.

She added, “Increasing women’s participation in STEM fields is also crucial, and at the same time, we must create an enabling environment to let the private sector come forward and establish new institutions. Ease of doing business is more important here than anywhere else. A supportive budget addressing these aspects will not only enable students to pursue their education dreams but also contribute significantly to India's long-term economic and intellectual growth.”

Equitable access to high-quality education

Rustom Kerawalla, Chairperson and Founder of VIBGYOR Group of schools said, “In the upcoming Union Budget 2024, we anticipate significant investment within the education sector. This includes enhancing infrastructure for effective education delivery, advancing teacher training, promoting inclusive education, and focusing on outcomes mapped to 21st-century skills. These priorities aim to ensure equitable access to high-quality education and build a resilient system that prepares students early on for real-world scenarios.”

He added, “Through collaborative tech-driven solutions, infrastructure upgrades, comprehensive training, advancements in pedagogy, and adapting to new-age learning methodologies, we can unleash the potential of educational reform.”



Strengthening the Digital Infrastructure

Rohit Manglik, the Founder & CEO of EduGorilla said, “Technology holds great promise to revolutionise the education sector. It plays a significant role in ensuring equity in access to education, making it more affordable, and enabling on-the-go learning. Hence, the Union Budget 2024-25 must earmark allocations towards strengthening digital infrastructure, such as the National Optical Fibre Network and ensuring reliable Internet connectivity.”

“It should also prioritise adopting new-age technologies beyond Artificial Intelligence, such as Augmented Reality and Virtual Reality, which have opened new avenues for immersive and interactive learning experiences,” he added.

Investments into the nation’s talent-pool

Aalok Kumar, the Corporate Officer & Senior VP – Head of the Global Smart City Business Development Department and President & CEO of NEC Corporation India, highlighted that the Government of India presented an interim budget that reinforced its vision for‘Viksit Bharat’ by 2047 - to accelerate India into a developed nation and foster inclusive economic participation among all citizens. “As we await the full budget, we expect clear and decisive provisions to advance this vision, with technology at the heart of this transformation.”

“While technology continues to drive India’s socio-economic progress, the key lies in building the nation into the knowledge capital of the world through enhanced R&D and innovation efforts. This will require continued and rigorous investments into the nation’s talent-pool through concerted training, skilling, and upskilling endeavours.”

Reduction in taxes for upskilling courses

Dr PR Sodani, the President of IIHMR University pointed out that with rapid technological advancements, students need to keep themselves updated for their secure future. “A reduction in taxes for upskilling courses will boost opportunities for innovation, inclusivity, allocation, and accessibility. Working closely with the healthcare sector, we urge for sturdy finance models to increase investment in healthcare infrastructure, consequently aiding the young minds engaged in health management studies.”

Reduction in GST on edtech services

Tarun Saini- CEO & Co-founder of Vidyakul, pointed out that edtech companies currently attract 18% GST, which impacts affordability in online education. “This is a concern that edtech companies have been talking about since the last budget session. A reduction in GST on edtech services will lower service prices, and boost affordability. We are hopeful the government will consider lowering the GST from the current 18%.”

“In addition to this, we are looking forward to a closer collaboration between policymakers, government, and startups in the form of PPPs (Public Private Partnerships) in the education sector. Connecting startups with education policymakers can create a powerful synergy to solve targeted problems and significantly enhance efforts to address critical issues,” he added.

Increasing the education budget to strengthen the educational framework

Sumit Singhal, Subject Matter Expert, at S.N. Dhawan & CO LLP, said, “The government should focus on increasing the education budget beyond 13% as it would provide continuous support for educational initiatives and further strengthen the educational framework.”

According to Singhal, such an increase would allow for more robust funding of critical programs, infrastructure development, and technological integration in schools and higher education institutions.”

Singhal also stressed on the need to reduce GST rates on digital educational content and services. “Lowering these rates would significantly enhance the affordability of online learning, which has become increasingly vital in today’s digital age. This measure would be advantageous for students by making high-quality educational resources more accessible, and at the same time, for edtech companies by fostering a more conducive environment for innovation and growth.”

He highlighted that a strategic increase in the education budget coupled with targeted tax relief measures can lead to substantial progress in the education sector, thereby benefiting students, and educators, and leading towards the transformation of the education sector.",,,https://www.hindustantimes.com/education/union-budget-2024-will-centre-meet-rising-demands-of-the-education-sector-here-s-what-experts-expect-in-latest-budget-101720684831700.html
hindustantimes.com,Union Budget 2024: How stock markets are likely to react before and after Budget,"The Union Budget 2024 is set to be presented on July 23 this year. During the interim Budget presentation on February 1, Finance Minister Nirmala Sitharaman emphasized on ‘Viksit Bharat by 2047’- a detailed roadmap of which is expected to be unveiled in the full budget. As per brokerage firm Morgan Stanley, the finance minister is likely to retain the central government’s fiscal deficit target at 5.1% of GDP in F2025, while being on track to attain the target of 4.5% of GDP by F2026. Union Budget 2024: Finance Minister Nirmala Sitharaman holds up the Union budget.(Reuters)

As per the brokerage firm, the stock market falls on two of three occasions in the 30 days post the budget. Probability of a fall rises to 80% if the market has risen in the 30 days preceding the budget, the analysis showed. The Indian stock market has been up both pre and post the budget only twice in 30 years.

As per Morgan Stanley, Indian stock market investors should focus on three things:",,,https://www.hindustantimes.com/budget/union-budget-2024-how-stock-markets-are-likely-to-react-before-and-after-budget-101720684910945.html
hindustantimes.com,Union Budget 2024: Will Nirmala Sitharaman bring income tax relief for middle class?,"With the Union Budget 2024 scheduled to be presented on July 23, 2024 by Finance Minister Nirmala Sitharaman, income tax slabs are an important component that has been getting a lot of attention lately, with reports suggesting there may be potential tax cuts for boosting consumption in the economy. Union finance minister Nirmala Sitharaman speaks in the Lok Sabha during the interim budget session of the Parliament, in New Delhi (ANI)



This is despite the fact that the Finance Minister did not announce any changes in taxation in the interim budget this year presented on February 1.

What is an income tax slab?

An income tax slab refers to the different income tax rates assigned to different income levels.



India’s income tax is a progressive system, meaning that as a person’s income increases, the amount of tax they pay also increases, and the higher the income, the higher the percentage of the income they have to pay as tax, depending on the slab they fall into.

What are the current income tax slabs?

Income tax in India is divided into two types: The new tax regime and the old tax regime. The new tax regime introduced in 2020 is the default regime, with taxpayers having the option to switch to the old regime if they want to.



Those with a salaried income can choose to opt for either in the beginning of any financial year, but for businesses and professionals, the choice can only be made once in a lifetime.

The current slabs for the new tax regime are as follows:

Up to ₹3 lakh: NIL

₹3-6 lakh: 5% on income which exceeds ₹3 lakh

₹6-9 lakh: ₹15,000 + 10% on income more than ₹6 lakh

₹9-12 lakh: ₹45,000 + 15% on income more than ₹9 lakh

₹12-15 lakh: ₹90,000 + 20% on income more than ₹12 lakh

Above ₹15 lakh: ₹1.5 lakh + 30% on income more than ₹15 lakh

For the old regime, there are three different slabs, divided on the basis of age groups; Below 60 years of age, which also includes the slabs for Hindu Undivided Families (HUFs), 60-80 years of age, and above 80 years of age.

For people below 60 years of age and for HUFs

Up to ₹2.5 lakh: NIL

₹2.5 lakh – ₹5 lakh: 5%

₹5 lakh – ₹10 lakh: 20%

Above ₹10 lakh: 30%

For people aged 60-80 years (Senior citizens)

₹0 – ₹3 lakh: NIL

₹3 lakh – ₹5 lakh: 5%

₹5 lakh – ₹10 lakh: 20%

Above ₹10 lakh: 30%

For people aged above 80 years (Super Senior Citizens)

₹0 – ₹5 lakh: NIL

₹5 lakh – ₹10 lakh: 20%

Above ₹10 lakh: 30%

What are the expected changes to the income tax slabs in the Union Budget 2024?

The government is considering to lower income tax rates for certain categories of individuals to boost consumption, Reuters had reported earlier, citing two unnamed government sources.

The government may also raise the standard deduction limit of ₹50,000 to somewhere between ₹50,000 to ₹1 lakh.",,,https://www.hindustantimes.com/budget/union-budget-2024-will-nirmala-sitharaman-bring-income-tax-relief-for-middle-class-101720591793379.html
